title,description,category,subcategory,section,input_type,required,weight,is_critical,options
Back-flow devices or back-flow situations does not exist.,,Hygiene & Cleanliness,Back of the house & equipment is clean,,option_select,yes,1,no,Yes:1|No:0|NA:NA
"Grease traps are not clogged, clean and in good condition",,Hygiene & Cleanliness,Back of the house & equipment is clean,,option_select,yes,1,no,Yes:1|No:0|NA:NA
"Trash container not damaged and is functional, no buildup and well maintained",,Hygiene & Cleanliness,Back of the house & equipment is clean,,option_select,yes,1,no,Yes:1|No:0|NA:NA
"Cleaning supplies are available (Wringer bucket trolley, Mop, Dry mop, Squeeze, Broom / Jobby Trolley, Dustpan, Toilet cleaner brush, Washroom cleaning caddy, Duster and gloves with colour coding), stored and maintained clean",,Hygiene & Cleanliness,tools & tackles,,option_select,yes,1,no,Yes:2|No:0|NA:NA
Chemicals (FOH & BOH) used according to proper procedure or manufacturer's directions.,,Hygiene & Cleanliness,tools & tackles,,option_select,yes,1,no,Yes:2|No:0|NA:NA
Dishwasher set up correctly and proper cleaning method followed.,,Hygiene & Cleanliness,tools & tackles,,option_select,yes,1,no,Yes:2|No:0|NA:NA
Pest activity is prevented through proper sealing of outer openings,,Hygiene & Cleanliness,tools & tackles,,option_select,yes,1,no,Yes:2|No:0|NA:NA
"Pest activity present, evidence exists that action has been taken.",,Hygiene & Cleanliness,tools & tackles,,option_select,yes,1,no,Yes:2|No:0|NA:NA
Pesticides are applied by approved vendors.,,Hygiene & Cleanliness,tools & tackles,,option_select,yes,1,no,Yes:2|No:0|NA:NA
Sanitizer at proper concentration in sanitizer sink,,Hygiene & Cleanliness,tools & tackles,,option_select,yes,1,no,Yes:2|No:0|NA:NA
Three-compartment/Power soak sink set up correctly or proper cleaning method followed.,,Hygiene & Cleanliness,tools & tackles,,option_select,yes,1,no,Yes:2|No:0|NA:NA
Wiping cloths used or stored properly in a sanitizer bucket with correct concentration.,,Hygiene & Cleanliness,tools & tackles,,option_select,yes,1,no,Yes:2|No:0|NA:NA
"No drinking, eating and smoking in areas not designated for these activities.",,Hygiene & Cleanliness,Proper appearance & conduct of Team Members,,option_select,yes,1,no,Yes:3|No:0|NA:NA
Gum or tobacco not allowed during working hours and in food service area.,,Hygiene & Cleanliness,Proper appearance & conduct of Team Members,,option_select,yes,1,no,Yes:3|No:0|NA:NA
Jewelry not worn on arms or hands except plain ring (i.e. wedding band) when handling food.,,Hygiene & Cleanliness,Proper appearance & conduct of Team Members,,option_select,yes,1,no,Yes:2|No:0|NA:NA
Proper hair restraints worn by all team members when handling food.,,Hygiene & Cleanliness,Proper appearance & conduct of Team Members,,option_select,yes,1,no,Yes:2|No:0|NA:NA
"Team members meet grooming or personal hygiene standards. Unapproved, incomplete, dirty or faded uniforms not worn by Team.",,Hygiene & Cleanliness,Proper appearance & conduct of Team Members,,option_select,yes,1,no,Yes:3|No:0|NA:NA
Staff meal menu is on display and meal is prepared as per menu.,,Hygiene & Cleanliness,Proper appearance & conduct of Team Members,,option_select,yes,1,no,Yes:1|No:0|NA:NA
"Safety compliance certificates available - FOSTAC, METRIC (weighing scale), FSSAI, PEST CONTROL AND HALAL",,Processes,,,option_select,yes,1,no,Yes:2|No:0|NA:NA
Hospitality Certifications are occurring and conducted periodically or / and as per training schedule. Team trained as per job designated,,Processes,,,option_select,yes,1,no,Yes:2|No:0|NA:NA
"Ingredients (eg condiments, mouth fresheners) and packaging adequately stocked prior to peak.",,Processes,,,option_select,yes,1,no,Yes:2|No:0|NA:NA
POS registers available and in use.,,Processes,,,option_select,yes,1,no,Yes:2|No:0|NA:NA
Fully staffed for current shift business needs,,Processes,,,option_select,yes,1,no,Yes:2|No:0|NA:NA
Proper deployment practices followed.,,Processes,,,option_select,yes,1,no,Yes:2|No:0|NA:NA
Team trained as per job designated,,Processes,,,option_select,yes,1,no,Yes:2|No:0|NA:NA
Table section plans are in place and being utilized.,,Processes,,,option_select,yes,1,no,Yes:2|No:0|NA:NA
Current and complete specification charts or job aids posted or used as designed.,,Processes,,,option_select,yes,1,no,Yes:2|No:0|NA:NA
"Projection, Ready for Revenue, prep guides or ordering systems in use.",,Processes,,,option_select,yes,1,no,Yes:2|No:0|NA:NA
Food being prepared as per recipe and correct SOP is followed,,Processes,,,option_select,yes,1,no,Yes:2|No:0|NA:NA
Food tasting record available,,Processes,,,option_select,yes,1,no,Yes:2|No:0|NA:NA
Evidence of cleaning systems/schedules/checklists in use.,,Processes,,,option_select,yes,1,no,Yes:2|No:0|NA:NA
Cleaning supplies are of sufficient availability,,Processes,,,option_select,yes,1,no,Yes:2|No:0|NA:NA
Chemicals properly labelled and MSDS available,,Processes,,,option_select,yes,1,no,Yes:2|No:0|NA:NA
All food items are labelled with MRD,,Processes,,,option_select,yes,1,no,Yes:2|No:0|NA:NA
CVR followed,,Processes,,,option_select,yes,1,no,Yes:2|No:0|NA:NA
QA Audit happening,,Processes,,,option_select,yes,1,no,Yes:2|No:0|NA:NA
Cashiering audit happening,,Processes,,,option_select,yes,1,no,Yes:2|No:0|NA:NA
Scheduled Coaching in place,,Processes,,,option_select,yes,1,no,Yes:2|No:0|NA:NA
Table Number,Enter the table number,Service,Speed of Service,Trnx-1,short_answer,yes,1,no,
Dish Name,Enter the name of the dish,Service,Speed of Service,Trnx-1,short_answer,yes,1,no,
Time - Attempt 1,Time in minutes (1st measurement),Service,Speed of Service,Trnx-1,number,yes,1,no,
Time - Attempt 2,Time in minutes (2nd measurement),Service,Speed of Service,Trnx-1,number,yes,1,no,
Time - Attempt 3,Time in minutes (3rd measurement),Service,Speed of Service,Trnx-1,number,yes,1,no,
Time - Attempt 4,Time in minutes (4th measurement),Service,Speed of Service,Trnx-1,number,yes,1,no,
Time - Attempt 5,Time in minutes (5th measurement),Service,Speed of Service,Trnx-1,number,yes,1,no,
Table Number,Enter the table number,Service,Speed of Service,Trnx-2,short_answer,yes,1,no,
Dish Name,Enter the name of the dish,Service,Speed of Service,Trnx-2,short_answer,yes,1,no,
Time - Attempt 1,Time in minutes (1st measurement),Service,Speed of Service,Trnx-2,number,yes,1,no,
Time - Attempt 2,Time in minutes (2nd measurement),Service,Speed of Service,Trnx-2,number,yes,1,no,
Time - Attempt 3,Time in minutes (3rd measurement),Service,Speed of Service,Trnx-2,number,yes,1,no,
Time - Attempt 4,Time in minutes (4th measurement),Service,Speed of Service,Trnx-2,number,yes,1,no,
Time - Attempt 5,Time in minutes (5th measurement),Service,Speed of Service,Trnx-2,number,yes,1,no,
Table Number,Enter the table number,Service,Speed of Service,Trnx-3,short_answer,yes,1,no,
Dish Name,Enter the name of the dish,Service,Speed of Service,Trnx-3,short_answer,yes,1,no,
Time - Attempt 1,Time in minutes (1st measurement),Service,Speed of Service,Trnx-3,number,yes,1,no,
Time - Attempt 2,Time in minutes (2nd measurement),Service,Speed of Service,Trnx-3,number,yes,1,no,
Time - Attempt 3,Time in minutes (3rd measurement),Service,Speed of Service,Trnx-3,number,yes,1,no,
Time - Attempt 4,Time in minutes (4th measurement),Service,Speed of Service,Trnx-3,number,yes,1,no,
Time - Attempt 5,Time in minutes (5th measurement),Service,Speed of Service,Trnx-3,number,yes,1,no,
Table Number,Enter the table number,Service,Speed of Service,Trnx-4,short_answer,yes,1,no,
Dish Name,Enter the name of the dish,Service,Speed of Service,Trnx-4,short_answer,yes,1,no,
Time - Attempt 1,Time in minutes (1st measurement),Service,Speed of Service,Trnx-4,number,yes,1,no,
Time - Attempt 2,Time in minutes (2nd measurement),Service,Speed of Service,Trnx-4,number,yes,1,no,
Time - Attempt 3,Time in minutes (3rd measurement),Service,Speed of Service,Trnx-4,number,yes,1,no,
Time - Attempt 4,Time in minutes (4th measurement),Service,Speed of Service,Trnx-4,number,yes,1,no,
Time - Attempt 5,Time in minutes (5th measurement),Service,Speed of Service,Trnx-4,number,yes,1,no,
Average (Auto),Auto-calculated average from all time measurements,Service,Speed of Service,Avg,number,yes,1,no,
Manager on Duty,Enter the manager name,Acknowledgement,,,short_answer,yes,1,no,
Signature,Sign to confirm,Acknowledgement,,,signature,yes,1,no,